{
  "$schema": "https://json-schema.org/draft/2020-12/schema",
  "$id": "https://little-logic-lab.local/schemas/child-profile.schema.json",
  "title": "LocalChildProfile",
  "description": "Runtime snapshot stored only in IndexedDB. It contains no account, full birth date or remote identifier.",
  "type": "object",
  "additionalProperties": false,
  "required": [
    "schemaVersion",
    "createdAtLocal",
    "ageMonths",
    "sessionLocked",
    "settings",
    "masteryBySkill",
    "progressByGame",
    "attempts",
    "sessions"
  ],
  "properties": {
    "schemaVersion": { "const": 4 },
    "createdAtLocal": { "type": "string", "format": "date-time" },
    "ageMonths": {
      "type": "integer",
      "minimum": 30,
      "maximum": 72,
      "description": "Approximate local age used only for conservative entry difficulty."
    },
    "sessionLocked": {
      "type": "boolean",
      "description": "True after a completed session; only Parent Mode may clear it."
    },
    "settings": {
      "type": "object",
      "additionalProperties": false,
      "required": [
        "audioEnabled",
        "musicEnabled",
        "voiceEnabled",
        "reducedMotion",
        "highContrast",
        "targetSize",
        "demonstrationSpeed",
        "sessionMinutes",
        "coPlayPrompts"
      ],
      "properties": {
        "audioEnabled": { "type": "boolean" },
        "musicEnabled": { "type": "boolean" },
        "voiceEnabled": { "type": "boolean" },
        "reducedMotion": { "type": "boolean" },
        "highContrast": { "type": "boolean" },
        "targetSize": { "enum": ["large", "extra_large"] },
        "demonstrationSpeed": { "enum": ["normal", "slow"] },
        "sessionMinutes": { "type": "integer", "enum": [3, 5, 7] },
        "coPlayPrompts": { "type": "boolean" }
      }
    },
    "masteryBySkill": {
      "type": "object",
      "additionalProperties": { "$ref": "#/$defs/mastery" }
    },
    "progressByGame": {
      "type": "object",
      "additionalProperties": { "$ref": "#/$defs/gameProgress" }
    },
    "attempts": {
      "type": "array",
      "maxItems": 400,
      "items": { "$ref": "#/$defs/attempt" }
    },
    "sessions": {
      "type": "array",
      "maxItems": 120,
      "items": { "$ref": "#/$defs/session" }
    }
  },
  "$defs": {
    "mastery": {
      "type": "object",
      "additionalProperties": false,
      "required": ["alpha", "beta", "evidenceCount", "lastPracticedAtLocal"],
      "properties": {
        "alpha": { "type": "number", "exclusiveMinimum": 0 },
        "beta": { "type": "number", "exclusiveMinimum": 0 },
        "evidenceCount": { "type": "integer", "minimum": 0 },
        "lastPracticedAtLocal": {
          "type": ["string", "null"],
          "format": "date-time"
        }
      }
    },
    "difficulty": {
      "type": "object",
      "additionalProperties": {
        "type": ["string", "number", "boolean"]
      }
    },
    "attempt": {
      "type": "object",
      "additionalProperties": false,
      "required": [
        "atLocal",
        "sessionId",
        "gameId",
        "skillId",
        "levelSeed",
        "ladderStageId",
        "contentVersion",
        "completed",
        "correctFirstTry",
        "correctEventually",
        "hintsUsed",
        "wrongAttempts",
        "abandoned"
      ],
      "properties": {
        "atLocal": { "type": "string", "format": "date-time" },
        "sessionId": { "type": "string", "minLength": 1 },
        "gameId": { "type": "string", "minLength": 1 },
        "skillId": { "type": "string", "minLength": 1 },
        "levelSeed": { "type": "string", "minLength": 1 },
        "ladderStageId": { "type": "string", "minLength": 1 },
        "contentVersion": { "type": "string", "minLength": 1 },
        "completed": { "type": "boolean" },
        "correctFirstTry": { "type": "boolean" },
        "correctEventually": { "type": "boolean" },
        "hintsUsed": { "type": "integer", "minimum": 0 },
        "wrongAttempts": { "type": "integer", "minimum": 0 },
        "abandoned": { "type": "boolean" }
      }
    },
    "gameProgress": {
      "type": "object",
      "additionalProperties": false,
      "required": ["difficulty", "recentOutcomes", "timesPlayed"],
      "properties": {
        "difficulty": { "$ref": "#/$defs/difficulty" },
        "recentOutcomes": {
          "type": "array",
          "maxItems": 6,
          "items": { "$ref": "#/$defs/attempt" }
        },
        "timesPlayed": { "type": "integer", "minimum": 0 }
      }
    },
    "session": {
      "type": "object",
      "additionalProperties": false,
      "required": ["sessionId", "atLocal", "minutes", "gamesPlayed"],
      "properties": {
        "sessionId": { "type": "string", "minLength": 1 },
        "atLocal": { "type": "string", "format": "date-time" },
        "minutes": { "type": "number", "minimum": 0 },
        "gamesPlayed": { "type": "integer", "minimum": 0 }
      }
    }
  }
}
