{
  "schemaVersion": 4,
  "createdAtLocal": "2026-07-24T12:00:00+03:00",
  "ageMonths": 31,
  "sessionLocked": false,
  "settings": {
    "audioEnabled": true,
    "musicEnabled": false,
    "voiceEnabled": true,
    "reducedMotion": true,
    "highContrast": false,
    "targetSize": "extra_large",
    "demonstrationSpeed": "slow",
    "sessionMinutes": 5,
    "coPlayPrompts": true
  },
  "masteryBySkill": {},
  "progressByGame": {},
  "attempts": [],
  "sessions": []
}
